{
  "schema_version": "1.0",
  "summary": {
    "target": "/home/user/.gemini\\antigravity\\scratch\\spe_trace\\main_orchestrator.py",
    "files_scanned": 1,
    "signals_total": 25,
    "risk_score": 100,
    "readiness_score": 14,
    "viability": "MODERATE_RISK_REVIEW_REQUIRED",
    "blockers": 0,
    "potential_high_risk": 0,
    "transparency_risks": 0,
    "gdpr_overlaps": 23,
    "governance_controls_detected": 2,
    "missing_governance_controls": [
      "CTRL_DATA_GOVERNANCE",
      "CTRL_FRIA_DPIA",
      "CTRL_HUMAN_OVERSIGHT",
      "CTRL_RISK_MANAGEMENT",
      "CTRL_TECHNICAL_DOCUMENTATION",
      "CTRL_TRANSPARENCY_INSTRUCTIONS"
    ],
    "notes": [
      "This is a static signal scanner. Treat results as triage, not as a legal conclusion.",
      "A clean scan does not prove compliance; risky intent can exist outside code names.",
      "GDPR overlap detected: AI Act review should be paired with privacy-by-design/DPIA analysis where personal data is involved."
    ]
  },
  "signals": [
    {
      "rule_id": "A5_SOCIAL_SCORING",
      "bucket": "article_5_prohibited_practice_signal",
      "legal_basis": "EU AI Act Article 5",
      "label": "Potential social scoring of natural persons",
      "severity": "ARTICLE_5_REVIEW_REQUIRED",
      "weight": 40,
      "file": "main_orchestrator.py",
      "line": 143,
      "symbol": "trust",
      "matched": "trust_score",
      "evidence": "\"url\": self.state[\"target_url\"],\n                \"trust\": self.state[\"company_profile\"].get(\"founding_date\", \"UNKNOWN\"),\n                \"spe_score\": self.state.get(\"metrics\", {}).get(\"spe_score\", 0)",
      "confidence": 0.45,
      "node_type": "StringLiteral",
      "guidance": "Confirm whether individuals are evaluated over time using social behaviour or personal characteristics with detrimental treatment."
    },
    {
      "rule_id": "A5_SOCIAL_SCORING",
      "bucket": "article_5_prohibited_practice_signal",
      "legal_basis": "EU AI Act Article 5",
      "label": "Potential social scoring of natural persons",
      "severity": "ARTICLE_5_REVIEW_REQUIRED",
      "weight": 40,
      "file": "main_orchestrator.py",
      "line": 144,
      "symbol": "spe_score",
      "matched": "trust_score",
      "evidence": "\"trust\": self.state[\"company_profile\"].get(\"founding_date\", \"UNKNOWN\"),\n                \"spe_score\": self.state.get(\"metrics\", {}).get(\"spe_score\", 0)\n            }).encode('utf-8')",
      "confidence": 0.45,
      "node_type": "StringLiteral",
      "guidance": "Confirm whether individuals are evaluated over time using social behaviour or personal characteristics with detrimental treatment."
    },
    {
      "rule_id": "GDPR_PERSONAL_DATA_PROCESSING",
      "bucket": "gdpr_data_protection_overlap",
      "legal_basis": "GDPR + EU AI Act complementarity",
      "label": "Potential personal data processing / profiling overlap",
      "severity": "DATA_PROTECTION_REVIEW",
      "weight": 18,
      "file": "main_orchestrator.py",
      "line": 60,
      "symbol": "target_url",
      "matched": "profile",
      "evidence": "\"started_at\": datetime.now().isoformat(),\n            \"target_url\": None,\n            \"company_profile\": {},",
      "confidence": 0.65,
      "node_type": "StringLiteral",
      "guidance": "If personal data is processed, GDPR controls must sit beside AI Act controls: lawful basis, minimisation, transparency, rights, security."
    },
    {
      "rule_id": "GDPR_PERSONAL_DATA_PROCESSING",
      "bucket": "gdpr_data_protection_overlap",
      "legal_basis": "GDPR + EU AI Act complementarity",
      "label": "Potential personal data processing / profiling overlap",
      "severity": "DATA_PROTECTION_REVIEW",
      "weight": 18,
      "file": "main_orchestrator.py",
      "line": 61,
      "symbol": "company_profile",
      "matched": "profile",
      "evidence": "\"target_url\": None,\n            \"company_profile\": {},\n            \"astro_mode_enabled\": False,",
      "confidence": 0.65,
      "node_type": "StringLiteral",
      "guidance": "If personal data is processed, GDPR controls must sit beside AI Act controls: lawful basis, minimisation, transparency, rights, security."
    },
    {
      "rule_id": "GDPR_PERSONAL_DATA_PROCESSING",
      "bucket": "gdpr_data_protection_overlap",
      "legal_basis": "GDPR + EU AI Act complementarity",
      "label": "Potential personal data processing / profiling overlap",
      "severity": "DATA_PROTECTION_REVIEW",
      "weight": 18,
      "file": "main_orchestrator.py",
      "line": 62,
      "symbol": "astro_mode_enabled",
      "matched": "profile",
      "evidence": "\"company_profile\": {},\n            \"astro_mode_enabled\": False,\n            \"metrics\": {},",
      "confidence": 0.65,
      "node_type": "StringLiteral",
      "guidance": "If personal data is processed, GDPR controls must sit beside AI Act controls: lawful basis, minimisation, transparency, rights, security."
    },
    {
      "rule_id": "GDPR_PERSONAL_DATA_PROCESSING",
      "bucket": "gdpr_data_protection_overlap",
      "legal_basis": "GDPR + EU AI Act complementarity",
      "label": "Potential personal data processing / profiling overlap",
      "severity": "DATA_PROTECTION_REVIEW",
      "weight": 18,
      "file": "main_orchestrator.py",
      "line": 94,
      "symbol": "debate",
      "matched": "profile",
      "evidence": "# Real interaction if key exists, mocked inside if fail happens\n                debate = consensus.generate_dynamic_prompts(self.state[\"company_profile\"])\n                transcript = debate.get(\"debate_transcript\", \"Discusi├│n simulada: SEO y Strategy acuerdan atacar keywords de autoridad.\")",
      "confidence": 0.65,
      "node_type": "Name",
      "guidance": "If personal data is processed, GDPR controls must sit beside AI Act controls: lawful basis, minimisation, transparency, rights, security."
    },
    {
      "rule_id": "GDPR_PERSONAL_DATA_PROCESSING",
      "bucket": "gdpr_data_protection_overlap",
      "legal_basis": "GDPR + EU AI Act complementarity",
      "label": "Potential personal data processing / profiling overlap",
      "severity": "DATA_PROTECTION_REVIEW",
      "weight": 18,
      "file": "main_orchestrator.py",
      "line": 95,
      "symbol": "transcript",
      "matched": "profile",
      "evidence": "debate = consensus.generate_dynamic_prompts(self.state[\"company_profile\"])\n                transcript = debate.get(\"debate_transcript\", \"Discusi├│n simulada: SEO y Strategy acuerdan atacar keywords de autoridad.\")\n                self.matrix.log(\"TheBoard\", f\"Debate de expertos iniciado: {transcript[:100]}...\", \"DISCOVERY\", {\"full_transcript\": transcript})",
      "confidence": 0.65,
      "node_type": "Name",
      "guidance": "If personal data is processed, GDPR controls must sit beside AI Act controls: lawful basis, minimisation, transparency, rights, security."
    },
    {
      "rule_id": "GDPR_PERSONAL_DATA_PROCESSING",
      "bucket": "gdpr_data_protection_overlap",
      "legal_basis": "GDPR + EU AI Act complementarity",
      "label": "Potential personal data processing / profiling overlap",
      "severity": "DATA_PROTECTION_REVIEW",
      "weight": 18,
      "file": "main_orchestrator.py",
      "line": 102,
      "symbol": "f_date",
      "matched": "profile",
      "evidence": "# Decisi├│n Cr├¡tica: Carta Astral vs Fallback\n            f_date = self.state[\"company_profile\"].get(\"founding_date\")\n            if f_date and len(f_date) >= 4: # Basic validation",
      "confidence": 0.65,
      "node_type": "Name",
      "guidance": "If personal data is processed, GDPR controls must sit beside AI Act controls: lawful basis, minimisation, transparency, rights, security."
    },
    {
      "rule_id": "GDPR_PERSONAL_DATA_PROCESSING",
      "bucket": "gdpr_data_protection_overlap",
      "legal_basis": "GDPR + EU AI Act complementarity",
      "label": "Potential personal data processing / profiling overlap",
      "severity": "DATA_PROTECTION_REVIEW",
      "weight": 18,
      "file": "main_orchestrator.py",
      "line": 103,
      "symbol": "f_date",
      "matched": "profile",
      "evidence": "f_date = self.state[\"company_profile\"].get(\"founding_date\")\n            if f_date and len(f_date) >= 4: # Basic validation\n                self.state[\"astro_mode_enabled\"] = True",
      "confidence": 0.65,
      "node_type": "Name",
      "guidance": "If personal data is processed, GDPR controls must sit beside AI Act controls: lawful basis, minimisation, transparency, rights, security."
    },
    {
      "rule_id": "GDPR_PERSONAL_DATA_PROCESSING",
      "bucket": "gdpr_data_protection_overlap",
      "legal_basis": "GDPR + EU AI Act complementarity",
      "label": "Potential personal data processing / profiling overlap",
      "severity": "DATA_PROTECTION_REVIEW",
      "weight": 18,
      "file": "main_orchestrator.py",
      "line": 142,
      "symbol": "url",
      "matched": "profile",
      "evidence": "\"session\": self.state[\"session_id\"],\n                \"url\": self.state[\"target_url\"],\n                \"trust\": self.state[\"company_profile\"].get(\"founding_date\", \"UNKNOWN\"),",
      "confidence": 0.65,
      "node_type": "StringLiteral",
      "guidance": "If personal data is processed, GDPR controls must sit beside AI Act controls: lawful basis, minimisation, transparency, rights, security."
    },
    {
      "rule_id": "GDPR_PERSONAL_DATA_PROCESSING",
      "bucket": "gdpr_data_protection_overlap",
      "legal_basis": "GDPR + EU AI Act complementarity",
      "label": "Potential personal data processing / profiling overlap",
      "severity": "DATA_PROTECTION_REVIEW",
      "weight": 18,
      "file": "main_orchestrator.py",
      "line": 143,
      "symbol": "trust",
      "matched": "profile",